{"calculation":{"angleUnit":"degrees","aspectRules":[{"angle":0,"maxOrb":8},{"angle":60,"maxOrb":6},{"angle":90,"maxOrb":8},{"angle":120,"maxOrb":8},{"angle":180,"maxOrb":8}],"calendar":"gregorian","coordinates":"geocentric","distanceUnit":"AU","ephemeris":"moshier","houseSystem":"placidus","houseTimeScale":"UT1","inputTimeScale":"UTC","julianDayTt":2451545.0007428704,"julianDayUt1":2451545.00000411,"planetTimeScale":"TT","positionType":"apparent","provider":"swiss-ephemeris","providerVersion":"2.10.03","referenceFrame":"ecliptic-of-date","scope":"basic-natal","speedUnit":"degrees/day","timeModel":"Swiss built-in leap seconds and Delta T; pre-1972 civil input treated as UT1","zodiac":"tropical"},"data":{"angles":[{"degreeInSign":29.016170796129757,"house":null,"id":"ascendant","isRetrograde":null,"longitude":119.01617079612976,"sign":"Cancer","signIndex":3,"speed":null},{"degreeInSign":29.137986761911247,"house":null,"id":"midheaven","isRetrograde":null,"longitude":29.137986761911247,"sign":"Aries","signIndex":0,"speed":null},{"degreeInSign":29.016170796129757,"house":null,"id":"descendant","isRetrograde":null,"longitude":299.01617079612976,"sign":"Capricorn","signIndex":9,"speed":null},{"degreeInSign":29.137986761911236,"house":null,"id":"imumCoeli","isRetrograde":null,"longitude":209.13798676191124,"sign":"Libra","signIndex":6,"speed":null}],"aspects":[{"angle":60,"applying":false,"body1":"sun","body2":"moon","maxOrb":6,"orb":2.954900979616667,"separation":57.04509902038333},{"angle":120,"applying":true,"body1":"sun","body2":"saturn","maxOrb":8,"orb":0.026715008884536928,"separation":120.02671500888454},{"angle":180,"applying":false,"body1":"moon","body2":"saturn","maxOrb":8,"orb":2.928185970732102,"separation":177.0718140292679},{"angle":90,"applying":true,"body1":"moon","body2":"uranus","maxOrb":8,"orb":1.4853985286297586,"separation":91.48539852862976},{"angle":60,"applying":false,"body1":"mercury","body2":"mars","maxOrb":6,"orb":3.9259648970624426,"separation":56.07403510293756},{"angle":120,"applying":false,"body1":"mercury","body2":"jupiter","maxOrb":8,"orb":6.636250926616867,"separation":113.36374907338313},{"angle":90,"applying":false,"body1":"venus","body2":"mars","maxOrb":8,"orb":3.6024867887259404,"separation":86.39751321127406},{"angle":60,"applying":true,"body1":"venus","body2":"neptune","maxOrb":6,"orb":1.6271780741435293,"separation":61.62717807414353},{"angle":60,"applying":false,"body1":"mars","body2":"jupiter","maxOrb":6,"orb":2.7102860295544247,"separation":57.289713970445575},{"angle":90,"applying":true,"body1":"jupiter","body2":"neptune","maxOrb":8,"orb":7.939950892423894,"separation":82.0600491075761},{"angle":90,"applying":false,"body1":"saturn","body2":"uranus","maxOrb":8,"orb":4.413584499361889,"separation":85.58641550063811},{"angle":90,"applying":true,"body1":"saturn","body2":"neptune","maxOrb":8,"orb":7.202657504640399,"separation":97.2026575046404},{"angle":60,"applying":false,"body1":"uranus","body2":"pluto","maxOrb":6,"orb":3.354514382251466,"separation":63.354514382251466}],"houseCusps":[119.01617079612976,146.50126093995488,176.91217102652487,209.13798676191124,240.59418942822944,270.23636571460145,299.01617079612976,326.5012609399549,356.9121710265249,29.137986761911247,60.594189428229434,90.23636571460146],"houses":[{"degreeInSign":29.016170796129757,"longitude":119.01617079612976,"number":1,"sign":"Cancer"},{"degreeInSign":26.501260939954875,"longitude":146.50126093995488,"number":2,"sign":"Leo"},{"degreeInSign":26.912171026524874,"longitude":176.91217102652487,"number":3,"sign":"Virgo"},{"degreeInSign":29.137986761911236,"longitude":209.13798676191124,"number":4,"sign":"Libra"},{"degreeInSign":0.5941894282294413,"longitude":240.59418942822944,"number":5,"sign":"Sagittarius"},{"degreeInSign":0.2363657146014475,"longitude":270.23636571460145,"number":6,"sign":"Capricorn"},{"degreeInSign":29.016170796129757,"longitude":299.01617079612976,"number":7,"sign":"Capricorn"},{"degreeInSign":26.501260939954875,"longitude":326.5012609399549,"number":8,"sign":"Aquarius"},{"degreeInSign":26.912171026524902,"longitude":356.9121710265249,"number":9,"sign":"Pisces"},{"degreeInSign":29.137986761911247,"longitude":29.137986761911247,"number":10,"sign":"Aries"},{"degreeInSign":0.5941894282294342,"longitude":60.594189428229434,"number":11,"sign":"Gemini"},{"degreeInSign":0.23636571460146172,"longitude":90.23636571460146,"number":12,"sign":"Cancer"}],"location":{"latitude":10.8231,"longitude":106.6297},"placements":[{"degreeInSign":10.368923865132672,"distanceAu":0.9833276447899746,"house":6,"id":"sun","isRetrograde":false,"latitude":0.000232326486206889,"longitude":280.3689238651327,"sign":"Capricorn","signIndex":9,"speed":1.0194320961214058},{"degreeInSign":13.323824844749339,"distanceAu":0.0026899773180392383,"house":4,"id":"moon","isRetrograde":false,"latitude":5.170814737161401,"longitude":223.32382484474934,"sign":"Scorpio","signIndex":7,"speed":12.021182111207215},{"degreeInSign":1.8892814035697825,"distanceAu":1.4154695009953795,"house":6,"id":"mercury","isRetrograde":false,"latitude":-0.9948255825785924,"longitude":271.8892814035698,"sign":"Capricorn","signIndex":9,"speed":1.5562541134975347},{"degreeInSign":1.5658032952332803,"distanceAu":1.1375794059909379,"house":5,"id":"venus","isRetrograde":false,"latitude":2.0663478754621685,"longitude":241.56580329523328,"sign":"Sagittarius","signIndex":8,"speed":1.2090397312886196},{"degreeInSign":27.96331650650734,"distanceAu":1.8496874555933316,"house":8,"id":"mars","isRetrograde":false,"latitude":-1.0677828970146508,"longitude":327.96331650650734,"sign":"Aquarius","signIndex":10,"speed":0.7756727755006882},{"degreeInSign":25.25303047695292,"distanceAu":4.621181401415434,"house":9,"id":"jupiter","isRetrograde":false,"latitude":-1.2621728142471946,"longitude":25.25303047695292,"sign":"Aries","signIndex":0,"speed":0.040761321538194305},{"degreeInSign":10.395638874017209,"distanceAu":8.652796036108082,"house":10,"id":"saturn","isRetrograde":true,"latitude":-2.444822535109489,"longitude":40.39563887401721,"sign":"Taurus","signIndex":1,"speed":-0.019944768921321864},{"degreeInSign":14.809223373379098,"distanceAu":20.727169246229725,"house":7,"id":"uranus","isRetrograde":false,"latitude":-0.6583328766022727,"longitude":314.8092233733791,"sign":"Aquarius","signIndex":10,"speed":0.05034355141125388},{"degreeInSign":3.1929813693768097,"distanceAu":31.02452717527034,"house":7,"id":"neptune","isRetrograde":false,"latitude":0.23499118181281747,"longitude":303.1929813693768,"sign":"Aquarius","signIndex":10,"speed":0.035570123953115894},{"degreeInSign":11.454708991127632,"distanceAu":31.064390155715024,"house":5,"id":"pluto","isRetrograde":false,"latitude":10.855202467668567,"longitude":251.45470899112763,"sign":"Sagittarius","signIndex":8,"speed":0.03515289423055406}],"utc":{"day":1,"hour":12,"minute":0,"month":1,"second":0,"year":2000}},"engineVersion":"0.10.0-alpha.1","errors":[],"schemaVersion":"1.0","warnings":["Moshier analytical ephemeris; no JPL/Swiss data files. Future UTC uses the provider's built-in time model, not live Earth-orientation data."]}
