{"calculation":{"action":"between","angleUnit":"degrees","computationalScope":"pureGeometry","group":"aspects","motionMode":"fixedSecond","provider":"supplied-positions","scope":"on-demand-query","speedUnit":"degrees/day"},"data":{"action":"between","aspect":{"angle":37.5,"applying":true,"matched":true,"maxOrb":1,"orb":0.5,"point1":"moving","point2":"fixed"},"distanceRate":-1,"group":"aspects","motionMode":"fixedSecond","positions":[{"degreeInSign":20,"house":null,"id":"moving","isRetrograde":false,"longitude":350,"sign":"Pisces","signIndex":11,"speed":1},{"degreeInSign":28,"house":null,"id":"fixed","isRetrograde":false,"longitude":28,"sign":"Aries","signIndex":0,"speed":4}],"relation":{"id":"moving:fixed","point1":"moving","point2":"fixed","separation":38,"signedDelta":38},"rule":{"angle":37.5,"maxOrb":1}},"engineVersion":"0.10.0-alpha.1","errors":[],"schemaVersion":"1.0","warnings":[]}
