{"calculation":{"action":"inspect","angleUnit":"degrees","aspectPreset":"custom","aspectRules":[{"angle":37.5,"maxOrb":15}],"calendar":"gregorian","computationalScope":"fullNatalThenSelection","coordinates":"geocentric","distanceUnit":"AU","ephemeris":"moshier","group":"aspects","houseSystem":"placidus","houseTimeScale":"UT1","inputTimeScale":"UTC","julianDayTt":2451545.0007428704,"julianDayUt1":2451545.00000411,"planetTimeScale":"TT","positionType":"apparent","provider":"swiss-ephemeris","providerVersion":"2.10.03","referenceFrame":"ecliptic-of-date","rulership":"traditional","scope":"on-demand-query","selectionPolicy":"bothSelectedEndpoints","sourceScope":"basic-natal","speedUnit":"degrees/day","timeModel":"Swiss built-in leap seconds and Delta T; pre-1972 civil input treated as UT1","zodiac":"tropical"},"data":{"action":"inspect","aspects":[],"chartKind":"individualNatal","coverage":{"matchedAspects":0,"pointPairs":1,"primaryPoints":2,"selectedHouses":0,"supportingPoints":0},"group":"aspects","houses":[],"points":[{"degreeInSign":10.368923865132672,"distanceAu":0.9833276447899746,"house":6,"id":"sun","isRetrograde":false,"kind":"body","latitude":0.000232326486206889,"longitude":280.3689238651327,"sign":"Capricorn","signIndex":9,"speed":1.0194320961214058},{"degreeInSign":13.323824844749339,"distanceAu":0.0026899773180392383,"house":4,"id":"moon","isRetrograde":false,"kind":"body","latitude":5.170814737161401,"longitude":223.32382484474934,"sign":"Scorpio","signIndex":7,"speed":12.021182111207215}],"primaryHouseIds":[],"primaryPointIds":["sun","moon"],"relations":[{"aspectIndexes":[],"id":"sun:moon","point1":"sun","point2":"moon","separation":57.04509902038333,"signedDelta":-57.04509902038333}],"selection":{"aspectSelection":"bothSelectedEndpoints","houseNumbers":[],"pointIds":["sun","moon"]}},"engineVersion":"0.10.0-alpha.1","errors":[],"schemaVersion":"1.0","warnings":[]}
